{
  "cases": [
    {
      "bench_id": "asciidoc_huge_synthetic_repeated_readme_v1",
      "input_sha256": "9d47a9a0a60309f4fbdac366db5c2e03830172cc20c91d60652b3be9fdfb7e0b",
      "median_wall_us": 1051903,
      "output_sha256": "6c95bd8e9eb75af283e2688be51634c188db3c50a8a95d9d577084aed6e7a704",
      "peak_rss_kb": 220580,
      "tool": "moonbit-cli"
    },
    {
      "bench_id": "asciidoc_huge_synthetic_repeated_readme_v1",
      "input_sha256": "9d47a9a0a60309f4fbdac366db5c2e03830172cc20c91d60652b3be9fdfb7e0b",
      "median_wall_us": 1040204,
      "output_sha256": "863270a40540b2c3658349521152f599ce2172300ec3d53146c244f04e2ebef1",
      "peak_rss_kb": null,
      "tool": "moonbit-engine"
    },
    {
      "bench_id": "asciidoc_large_synthetic_repeated_readme_v1",
      "input_sha256": "809cdae9a7798c18a76e424c74739ad2b9ec2f6ce6d7c615d1bc50dd98cdfec7",
      "median_wall_us": 172481,
      "output_sha256": "b3b2e75d5bf5d50d3bee23ecc1240112bb701a284176fac27e303dda1d640df4",
      "peak_rss_kb": 54744,
      "tool": "moonbit-cli"
    },
    {
      "bench_id": "asciidoc_large_synthetic_repeated_readme_v1",
      "input_sha256": "809cdae9a7798c18a76e424c74739ad2b9ec2f6ce6d7c615d1bc50dd98cdfec7",
      "median_wall_us": 189401,
      "output_sha256": "d785c11d9892b22ef97343e382c1303bf84cb9b3206ff082aa222ad07b0ec823",
      "peak_rss_kb": null,
      "tool": "moonbit-engine"
    },
    {
      "bench_id": "asciidoc_medium_asciidoctor_readme_v1",
      "input_sha256": "18c0db23bc4528a768824e5b84bc3a2ad4c62c897cc764c18cac0c4e119eac08",
      "median_wall_us": 10161,
      "output_sha256": "e3c832a3907a3f4d948efe7bfd4543e169fd6d9d98ce161ee14088d3a9ddd496",
      "peak_rss_kb": 11904,
      "tool": "moonbit-cli"
    },
    {
      "bench_id": "asciidoc_medium_asciidoctor_readme_v1",
      "input_sha256": "18c0db23bc4528a768824e5b84bc3a2ad4c62c897cc764c18cac0c4e119eac08",
      "median_wall_us": 5567,
      "output_sha256": "b1bbf5250dd1958585a0bf7d6bf093fb708edec22325dd883d1518204757b284",
      "peak_rss_kb": null,
      "tool": "moonbit-engine"
    },
    {
      "bench_id": "audio_contract_m4a_v1",
      "input_sha256": "acc1c09781afc46c65b9ac200f0849e4bf4a671a257f054e35a781badf2b82dd",
      "median_wall_us": 1347742,
      "output_sha256": "c28e7b06e5ecabe6eb9f6b6a1507b0ca2171a25ca5aac9ef9048b371690de2a0",
      "peak_rss_kb": 13888,
      "tool": "moonbit-cli"
    },
    {
      "bench_id": "audio_contract_m4a_v1",
      "input_sha256": "acc1c09781afc46c65b9ac200f0849e4bf4a671a257f054e35a781badf2b82dd",
      "median_wall_us": 1334558,
      "output_sha256": "30210db642a5463a5f4c5e9f2c353adfacd984bda12d9c651b19f9169d6bd714",
      "peak_rss_kb": null,
      "tool": "moonbit-engine"
    },
    {
      "bench_id": "audio_contract_mp3_v1",
      "input_sha256": "db5bd55dfcbb0f7fdbcbf83044dbdc184ebb6e4bc8d482d5564d543bfa400897",
      "median_wall_us": 1353010,
      "output_sha256": "ff55448e4c497cceac9f6d96f7996ccfd717c44b98e28b09f745a98ea5913b45",
      "peak_rss_kb": 13840,
      "tool": "moonbit-cli"
    },
    {
      "bench_id": "audio_contract_mp3_v1",
      "input_sha256": "db5bd55dfcbb0f7fdbcbf83044dbdc184ebb6e4bc8d482d5564d543bfa400897",
      "median_wall_us": 1324495,
      "output_sha256": "b414a5b668469ef74b28b7a6d1a2d798404ad4837a45573498d52aa523ada9ec",
      "peak_rss_kb": null,
      "tool": "moonbit-engine"
    },
    {
      "bench_id": "audio_contract_wav_v1",
      "input_sha256": "dab7f88876960e5a265bdf3666ed58ab44ad780f75daa327ff7ea6aed378aa39",
      "median_wall_us": 1279442,
      "output_sha256": "45820bda3d3051f7320b124d688a5c86d5045d3a45a1dd90237e1c4f1a107558",
      "peak_rss_kb": 13792,
      "tool": "moonbit-cli"
    },
    {
      "bench_id": "audio_contract_wav_v1",
      "input_sha256": "dab7f88876960e5a265bdf3666ed58ab44ad780f75daa327ff7ea6aed378aa39",
      "median_wall_us": 1249457,
      "output_sha256": "37239665e8e18156128d150c043b9f581c1a3536757a256a1a50ad29b3dc5c90",
      "peak_rss_kb": null,
      "tool": "moonbit-engine"
    },
    {
      "bench_id": "eml_huge_synthetic_many_attachments_v1",
      "input_sha256": "6233946fd97bb37ab92c834d27a6856be812ba2a112b85bba9d6c692a9f1e794",
      "median_wall_us": 204863,
      "output_sha256": "2d008148940b8723e5934189b66da0f71be5cda25bb149a7c8c69ab0aff848d9",
      "peak_rss_kb": 171276,
      "tool": "moonbit-cli"
    },
    {
      "bench_id": "eml_huge_synthetic_many_attachments_v1",
      "input_sha256": "6233946fd97bb37ab92c834d27a6856be812ba2a112b85bba9d6c692a9f1e794",
      "median_wall_us": 201663,
      "output_sha256": "ca3726844826229e1bcfcad08ad130eedaf14477266d0630cf0063cb2e77f609",
      "peak_rss_kb": null,
      "tool": "moonbit-engine"
    },
    {
      "bench_id": "eml_large_synthetic_many_attachments_v1",
      "input_sha256": "afe965800b244bd30ee525e5b75a6ef20326b2452530d307124832f6e01fc145",
      "median_wall_us": 27089,
      "output_sha256": "4b2d999b973f7196f1ff245f9e504c13bb64e15d59a570c7d2da435fd580ae19",
      "peak_rss_kb": 17892,
      "tool": "moonbit-cli"
    },
    {
      "bench_id": "eml_large_synthetic_many_attachments_v1",
      "input_sha256": "afe965800b244bd30ee525e5b75a6ef20326b2452530d307124832f6e01fc145",
      "median_wall_us": 18136,
      "output_sha256": "da34f3f6ac6e107c7fe49b6e9c7126afc3156cd40d15f0cd56bd2007aaa4be49",
      "peak_rss_kb": null,
      "tool": "moonbit-engine"
    },
    {
      "bench_id": "eml_medium_apache_james_simple_attachment_v1",
      "input_sha256": "46da0c106d2dd6bb9e4b63e079a367ddc1a2bd472869a662d86da24918e3499f",
      "median_wall_us": 2663,
      "output_sha256": "b4bedc5ce0feb1f8b730bed51d1f7e4d9e37093aa1099f6bbed981b65526a796",
      "peak_rss_kb": 7448,
      "tool": "moonbit-cli"
    },
    {
      "bench_id": "eml_medium_apache_james_simple_attachment_v1",
      "input_sha256": "46da0c106d2dd6bb9e4b63e079a367ddc1a2bd472869a662d86da24918e3499f",
      "median_wall_us": 570,
      "output_sha256": "88e45412b1bd9a60e197be855507738e5f4d734d00aa844da4eb59ee51a6bf89",
      "peak_rss_kb": null,
      "tool": "moonbit-engine"
    },
    {
      "bench_id": "ipynb_huge_synthetic_repeated_cells_v1",
      "input_sha256": "7d1b4046905fa788a6ba167933b25a4b8f5611e6335e92fbad0844f81477470f",
      "median_wall_us": 672760,
      "output_sha256": "6ecb1b95abb02b20c8f1f3a79a78d92fbc8022d2bbf133aeb9c726148c8a97c8",
      "peak_rss_kb": 181616,
      "tool": "moonbit-cli"
    },
    {
      "bench_id": "ipynb_huge_synthetic_repeated_cells_v1",
      "input_sha256": "7d1b4046905fa788a6ba167933b25a4b8f5611e6335e92fbad0844f81477470f",
      "median_wall_us": 455705,
      "output_sha256": "b574b79ae27c53b9f050fae79b62fa099ed106ac0b094be970ccee5981c3157c",
      "peak_rss_kb": null,
      "tool": "moonbit-engine"
    },
    {
      "bench_id": "ipynb_large_synthetic_repeated_cells_v1",
      "input_sha256": "3510e307509b333b895e2344f9cab4a0a70098fb6052177e6cef83a49106d212",
      "median_wall_us": 515144,
      "output_sha256": "7727e99a52474dcd36b0535db51501b98fefab3e6f9d82f8670658331487fe1e",
      "peak_rss_kb": 56848,
      "tool": "moonbit-cli"
    },
    {
      "bench_id": "ipynb_large_synthetic_repeated_cells_v1",
      "input_sha256": "3510e307509b333b895e2344f9cab4a0a70098fb6052177e6cef83a49106d212",
      "median_wall_us": 388857,
      "output_sha256": "f6a1cee54c256d4fedaa54260725965d0ab49088c152bade418f3ea39fd2be85",
      "peak_rss_kb": null,
      "tool": "moonbit-engine"
    },
    {
      "bench_id": "json_huge_synthetic_records_v1",
      "input_sha256": "ca9117ba56dc7fa956f4a29dc7001fb64292b8f9f27b58aec321e0a09753b328",
      "median_wall_us": 618509,
      "output_sha256": "567c783b3321694ad82a7039078e206cd88696e97c323504a866bed71b55b0ea",
      "peak_rss_kb": 167228,
      "tool": "moonbit-cli"
    },
    {
      "bench_id": "json_huge_synthetic_records_v1",
      "input_sha256": "ca9117ba56dc7fa956f4a29dc7001fb64292b8f9f27b58aec321e0a09753b328",
      "median_wall_us": 576738,
      "output_sha256": "d7a171a4f4085a993c4fc24953bd0c2e8a4bb4a73651b9c244ad6b889f4f1f53",
      "peak_rss_kb": null,
      "tool": "moonbit-engine"
    },
    {
      "bench_id": "json_large_worldbank_population_v1",
      "input_sha256": "2bb1839c140419b1cf1aebe61a140bed870917d2d2ba5a3d5afaa342cb50e3a0",
      "median_wall_us": 190465,
      "output_sha256": "d84c9f69181fe3aef5db200aecb0b324a8dd558220653d8306288ba672bfaf88",
      "peak_rss_kb": 101868,
      "tool": "moonbit-cli"
    },
    {
      "bench_id": "json_large_worldbank_population_v1",
      "input_sha256": "2bb1839c140419b1cf1aebe61a140bed870917d2d2ba5a3d5afaa342cb50e3a0",
      "median_wall_us": 197893,
      "output_sha256": "38b7c9fe3985467130b33661d956029fb11c162c2fbd129e45078806dd1dc51c",
      "peak_rss_kb": null,
      "tool": "moonbit-engine"
    },
    {
      "bench_id": "json_medium_spdx_licenses_v1",
      "input_sha256": "c5a51836621ec723afcce3ff5728fd35653d806ca1086ee69f0fa9df28943d9c",
      "median_wall_us": 27670,
      "output_sha256": "cf968db5920672d5411ed05899fe3952e72d5159583893ac58c69e2e6a62312e",
      "peak_rss_kb": 17904,
      "tool": "moonbit-cli"
    },
    {
      "bench_id": "json_medium_spdx_licenses_v1",
      "input_sha256": "c5a51836621ec723afcce3ff5728fd35653d806ca1086ee69f0fa9df28943d9c",
      "median_wall_us": 23585,
      "output_sha256": "77741ed47bad6776555e05a1faaae1732418fcca3cb4e41a255c0b849b9b56bc",
      "peak_rss_kb": null,
      "tool": "moonbit-engine"
    },
    {
      "bench_id": "jsonl_huge_synthetic_records_v1",
      "input_sha256": "9183936feb00ae37f1af426ef1858f37832ef10a4c54fe12904d3d07350657b8",
      "median_wall_us": 167367,
      "output_sha256": "ebc335b9077871da64e0be2caeec21a8c04ee0dec06ba1a765e158a2225800a3",
      "peak_rss_kb": 167384,
      "tool": "moonbit-cli"
    },
    {
      "bench_id": "jsonl_huge_synthetic_records_v1",
      "input_sha256": "9183936feb00ae37f1af426ef1858f37832ef10a4c54fe12904d3d07350657b8",